{
  "$schema": "http://json-schema.org/draft-07/schema#",
  "type": "object",
  "additionalProperties": false,
  "required": ["schema_version", "policies", "workloads", "phases", "cells"],
  "properties": {
    "schema_version": {"const": 1},
    "policies": {"type": "object", "minProperties": 1, "additionalProperties": {"type": "object"}},
    "workloads": {"type": "object", "minProperties": 1, "additionalProperties": {"type": "object"}},
    "phases": {"type": "array", "minItems": 1, "items": {"type": "string"}, "uniqueItems": true},
    "cells": {"type": "object", "minProperties": 1, "additionalProperties": {"type": "object", "additionalProperties": false, "required": ["phase", "model_alias", "device_group", "server_argv", "benchmark_argv", "environment", "variant_keys", "workload", "trial_policy", "required_metrics", "timeout_seconds", "port", "warmup_runs", "recorded_runs", "promotion_policy"], "properties": {"phase": {"type": "string"}, "predecessor": {"type": "string"}, "model_alias": {"type": "string"}, "device_group": {"type": "string"}, "server_argv": {"type": "array", "items": {"type": "string"}}, "benchmark_argv": {"type": "array", "items": {"type": "string"}}, "environment": {"type": "object", "additionalProperties": {"type": "string"}}, "variant_keys": {"type": "array", "items": {"type": "string"}, "uniqueItems": true}, "workload": {"type": "string"}, "trial_policy": {"enum": ["smoke", "screen", "confirm"]}, "required_metrics": {"type": "array", "items": {"type": "string"}}, "timeout_seconds": {"type": "number", "exclusiveMinimum": 0}, "port": {"type": "integer", "minimum": 1, "maximum": 65535}, "warmup_runs": {"type": "integer", "minimum": 0}, "recorded_runs": {"type": "integer", "minimum": 1}, "promotion_policy": {"type": "string"}}}}
  }
}
